"SKU","Title","Quantity","Price","Category","Images","Description","Traits","shipping_price","shipping_type","shipping_carrier","shipping_service","shipping_package","noindex","force_update"
"SKU1522083230","Pink Car Lashes Headlight Eyelashes Accessories 3M Sticker - Universal ","45","12.99","Vehicles & Parts >> Vehicle Parts & Accessories >> Motor Vehicle Exterior","https://images.bonanzastatic.com/afu/images/00a4/c667/ba21_4576025344/1400741715-411495377.jpg https://images.bonanzastatic.com/afu/images/383f/4335/5399_4576025588/1320859021-1386790893.jpg https://images.bonanzastatic.com/afu/images/b174/7e1b/716e_4576025759/22-26-14-__1.jpg https://images.bonanzastatic.com/afu/images/e14a/a274/e529_4576026418/s-for-cars-3D-eyeliner-feminist-fashion-car-Headlight-cute-striker-with-Exotic-Eyeliner-7-Colors.jpg","     <div style=""color: rgb(64, 64, 64); font-family: Arial, Helvetica, FreeSans, sans-serif; font-size: 14px; box-sizing: content-box; margin: 0px; padding: 0px; border: 0px; font-variant-numeric: inherit; font-stretch: inherit; line-height: 16.9px; vertical-align: baseline; background-color: rgb(255, 255, 255);""> <div><span style='font-family: ""Trebuchet MS""; font-size: 12px;'><b><u>LIMITED TIME PROMOTION</u>!</b></span></div>  <div> </div> </div>  <div style=""color: rgb(64, 64, 64); font-family: Arial, Helvetica, FreeSans, sans-serif; font-size: 14px; box-sizing: content-box; margin: 0px; padding: 0px; border: 0px; font-variant-numeric: inherit; font-stretch: inherit; line-height: 16.9px; vertical-align: baseline; background-color: rgb(255, 255, 255);""> </div>  <div style=""color: rgb(64, 64, 64); font-family: Arial, Helvetica, FreeSans, sans-serif; font-size: 14px; box-sizing: content-box; margin: 0px; padding: 0px; border: 0px; font-variant-numeric: inherit; font-stretch: inherit; line-height: 16.9px; vertical-align: baseline; background-color: rgb(255, 255, 255);""><span style=""box-sizing: content-box; margin: 0px; padding: 0px; border: 0px; font-style: inherit; font-variant: inherit; font-weight: inherit; font-stretch: inherit; line-height: inherit; font-family: inherit; vertical-align: baseline;""><span style=""font-size: 25px;"">100% new never used ! Good quality!</span></span></div>  <div style=""color: rgb(64, 64, 64); font-family: Arial, Helvetica, FreeSans, sans-serif; font-size: 14px; box-sizing: content-box; margin: 0px; padding: 0px; border: 0px; font-variant-numeric: inherit; font-stretch: inherit; line-height: 16.9px; vertical-align: baseline; background-color: rgb(255, 255, 255);""> <div style=""box-sizing: content-box; margin: 0px; padding: 0px; border: 0px; font-style: inherit; font-variant: inherit; font-weight: inherit; font-stretch: inherit; line-height: inherit; font-family: inherit; vertical-align: baseline;""> <p style=""margin: 0px; font-family: inherit; font-style: inherit; font-variant: inherit; font-weight: inherit; box-sizing: content-box; padding: 0px; border: 0px; font-stretch: inherit; line-height: inherit; vertical-align: baseline;""><span style=""box-sizing: content-box; margin: 0px; padding: 0px; border: 0px; font-style: inherit; font-variant: inherit; font-weight: inherit; font-stretch: inherit; line-height: inherit; font-family: inherit; vertical-align: baseline;""><span style=""font-size: 25px;"">come with double sided tape that's durable yet doesn't hurt car paint.</span></span></p>  <p style=""margin: 0px; font-family: inherit; font-style: inherit; font-variant: inherit; font-weight: inherit; box-sizing: content-box; padding: 0px; border: 0px; font-stretch: inherit; line-height: inherit; vertical-align: baseline;""><br style=""box-sizing: content-box;""> <span style=""box-sizing: content-box; margin: 0px; padding: 0px; border: 0px; font-style: inherit; font-variant: inherit; font-weight: inherit; font-stretch: inherit; line-height: inherit; font-family: inherit; vertical-align: baseline;""><span style=""font-size: 25px;"">flexible and fit most Cars</span></span></p>  <p style=""margin: 0px; font-family: inherit; font-style: inherit; font-variant: inherit; font-weight: inherit; box-sizing: content-box; padding: 0px; border: 0px; font-stretch: inherit; line-height: inherit; vertical-align: baseline;""> </p>  <p style=""margin: 0px; font-family: inherit; font-style: inherit; font-variant: inherit; font-weight: inherit; box-sizing: content-box; padding: 0px; border: 0px; font-stretch: inherit; line-height: inherit; vertical-align: baseline;""><span style=""box-sizing: content-box; margin: 0px; padding: 0px; border: 0px; font-style: inherit; font-variant: inherit; font-weight: inherit; font-stretch: inherit; line-height: inherit; font-family: inherit; vertical-align: baseline;""><span style=""font-size: 25px;"">Made of durable plastic.</span></span></p>  <p style=""margin: 0px; font-family: inherit; font-style: inherit; font-variant: inherit; font-weight: inherit; box-sizing: content-box; padding: 0px; border: 0px; font-stretch: inherit; line-height: inherit; vertical-align: baseline;""> </p>  <p style=""margin: 0px; font-family: inherit; font-style: inherit; font-variant: inherit; font-weight: inherit; box-sizing: content-box; padding: 0px; border: 0px; font-stretch: inherit; line-height: inherit; vertical-align: baseline;""><span style=""box-sizing: content-box; margin: 0px; padding: 0px; border: 0px; font-style: inherit; font-variant: inherit; font-weight: inherit; font-stretch: inherit; line-height: inherit; font-family: inherit; vertical-align: baseline;""><span style=""box-sizing: content-box; margin: 0px; padding: 0px; border: 0px; font-style: inherit; font-variant: inherit; font-weight: inherit; font-stretch: inherit; line-height: 15.2px; font-family: inherit; vertical-align: baseline;""><span style=""font-size: x-large; line-height: 16.9px; font-family: inherit; font-style: inherit; font-variant-ligatures: inherit; font-variant-caps: inherit; font-weight: inherit;"">Package: </span><span style=""font-size: 25px;"">1 pair / each package.</span></span></span></p>  <div> </div> </div> </div>   ","[[Condition:New]] [[MPN:lashes-pink]] [[UPC:799632638933]] [[Brand:Lolashopfeb ]] ","4.9","flat","usps","International2to3weeks","normal","FALSE","TRUE"
"SKU1522083234","Black Car Lashes Headlight Eyelashes Accessories 3M Sticker For all Volkswagon  ","43","10","Vehicles & Parts >> Vehicle Parts & Accessories >> Motor Vehicle Exterior","https://images.bonanzastatic.com/afu/images/162f/c061/1c03_4833714515/23-23-17-9bu.jpg https://images.bonanzastatic.com/afu/images/79bd/c6d2/10f1_4833714901/23-23-08-images.jpg https://images.bonanzastatic.com/afu/images/1da2/2b8e/2177_4833715362/23-23-02-images.jpg https://images.bonanzastatic.com/afu/images/a986/a1d8/550c_4833715660/23-23-34-1aaf8e7a05585be7f104ef4a6fc036b3--car-headlights-false-eyelashes.jpg https://images.bonanzastatic.com/afu/images/feb1/b7b3/bc9e_4833716198/23-23-39-21-img_1479.jpg https://images.bonanzastatic.com/afu/images/1304/e8be/7d25_4833716496/23-22-55-images.jpg https://images.bonanzastatic.com/afu/images/ede2/9fa7/c2a8_4646241809/car_lashes_curves.jpg https://images.bonanzastatic.com/afu/images/bc67/b4d3/6512_4646241893/car5.jpg https://images.bonanzastatic.com/afu/images/bdd2/1145/5aa8_4646241945/car6.jpg","     <div style=""box-sizing: content-box; margin: 0px; padding: 0px; border: 0px; font-variant-numeric: inherit; font-stretch: inherit; line-height: 16.9px; vertical-align: baseline; background-color: rgb(255, 255, 255);""> <div><span style='font-family: ""Trebuchet MS""; font-size: 12px;'><b><u>LIMITED TIME PROMOTION</u>! </b></span></div>  <div><span style='font-family: ""Trebuchet MS"";'><b><span style=""font-size: 12px;"">YOU </span><span style=""font-size: 25px;"">BUY</span><span style=""font-size: 12px;""> </span><span style=""font-size: 30px;"">2</span><span style=""font-size: 12px;"">, I'LL </span><span style=""font-size: 25px;"">SHIP</span><span style=""font-size: 12px;""> </span><span style=""font-size: 30px;"">3</span></b></span></div> </div>  <div style=""box-sizing: content-box; margin: 0px; padding: 0px; border: 0px; font-variant-numeric: inherit; font-stretch: inherit; line-height: 16.9px; vertical-align: baseline; background-color: rgb(255, 255, 255);""> </div>  <div style=""box-sizing: content-box; margin: 0px; padding: 0px; border: 0px; font-variant-numeric: inherit; font-stretch: inherit; line-height: 16.9px; vertical-align: baseline; background-color: rgb(255, 255, 255);""><span style=""box-sizing: content-box; margin: 0px; padding: 0px; border: 0px; font-style: inherit; font-variant: inherit; font-weight: inherit; font-stretch: inherit; line-height: inherit; font-family: inherit; vertical-align: baseline;""><span style=""font-size: 25px;"">100% new never used ! Good quality!<span style=""box-sizing: content-box; margin: 0px; padding: 0px; border: 0px; font-style: inherit; font-variant: inherit; font-weight: inherit; font-stretch: inherit; line-height: 1.5; font-family: inherit; vertical-align: baseline;""> </span></span></span></div>  <div style=""box-sizing: content-box; margin: 0px; padding: 0px; border: 0px; font-variant-numeric: inherit; font-stretch: inherit; line-height: 16.9px; vertical-align: baseline; background-color: rgb(255, 255, 255);""> <div style=""box-sizing: content-box; margin: 0px; padding: 0px; border: 0px; font-style: inherit; font-variant: inherit; font-weight: inherit; font-stretch: inherit; line-height: inherit; font-family: inherit; vertical-align: baseline;""> <p style=""box-sizing: content-box; margin: 0px; padding: 0px; border: 0px; font-style: inherit; font-variant: inherit; font-weight: inherit; font-stretch: inherit; line-height: inherit; font-family: inherit; vertical-align: baseline;""><span style=""box-sizing: content-box; margin: 0px; padding: 0px; border: 0px; font-style: inherit; font-variant: inherit; font-weight: inherit; font-stretch: inherit; line-height: inherit; font-family: inherit; vertical-align: baseline;""><span style=""font-size: 25px;"">come with double sided tape that's durable yet doesn't hurt car paint.</span></span></p>  <p style=""box-sizing: content-box; margin: 0px; padding: 0px; border: 0px; font-style: inherit; font-variant: inherit; font-weight: inherit; font-stretch: inherit; line-height: inherit; font-family: inherit; vertical-align: baseline;""><br style=""box-sizing: content-box;""> <span style=""box-sizing: content-box; margin: 0px; padding: 0px; border: 0px; font-style: inherit; font-variant: inherit; font-weight: inherit; font-stretch: inherit; line-height: inherit; font-family: inherit; vertical-align: baseline;""><span style=""font-size: 25px;"">flexible and fit most Cars</span></span></p>  <p style=""box-sizing: content-box; margin: 0px; padding: 0px; border: 0px; font-style: inherit; font-variant: inherit; font-weight: inherit; font-stretch: inherit; line-height: inherit; font-family: inherit; vertical-align: baseline;""> </p>  <p style=""box-sizing: content-box; margin: 0px; padding: 0px; border: 0px; font-style: inherit; font-variant: inherit; font-weight: inherit; font-stretch: inherit; line-height: inherit; font-family: inherit; vertical-align: baseline;""><span style=""box-sizing: content-box; margin: 0px; padding: 0px; border: 0px; font-style: inherit; font-variant: inherit; font-weight: inherit; font-stretch: inherit; line-height: inherit; font-family: inherit; vertical-align: baseline;""><span style=""font-size: 25px;"">Made of durable plastic. </span></span></p>  <p style=""box-sizing: content-box; margin: 0px; padding: 0px; border: 0px; font-style: inherit; font-variant: inherit; font-weight: inherit; font-stretch: inherit; line-height: inherit; font-family: inherit; vertical-align: baseline;""> </p>  <p style=""box-sizing: content-box; margin: 0px; padding: 0px; border: 0px; font-style: inherit; font-variant: inherit; font-weight: inherit; font-stretch: inherit; line-height: inherit; font-family: inherit; vertical-align: baseline;""><span style=""box-sizing: content-box; margin: 0px; padding: 0px; border: 0px; font-style: inherit; font-variant: inherit; font-weight: inherit; font-stretch: inherit; line-height: inherit; font-family: inherit; vertical-align: baseline;""><span style=""box-sizing: content-box; margin: 0px; padding: 0px; border: 0px; font-style: inherit; font-variant: inherit; font-weight: inherit; font-stretch: inherit; line-height: 15.2px; font-family: inherit; vertical-align: baseline;""><span style=""font-size: x-large; line-height: 16.9px; font-family: inherit; font-style: inherit; font-variant-ligatures: inherit; font-variant-caps: inherit; font-weight: inherit;"">Package: </span><span style=""font-size: 25px;"">1 pair / each package.</span></span></span></p>  <p style=""box-sizing: content-box; margin: 0px; padding: 0px; border: 0px; font-style: inherit; font-variant: inherit; font-weight: inherit; font-stretch: inherit; line-height: inherit; font-family: inherit; vertical-align: baseline;""> </p> </div> </div>   ","[[Condition:New]] [[Brand:Lolashopfeb ]] ","4.9","flat","usps","International2to3weeks","normal","FALSE","TRUE"
"SKU1522083237","Black Car Lashes Headlight Eyelashes Accessories 3M Sticker - Universal ","246","6.99","Vehicles & Parts >> Vehicle Parts & Accessories >> Motor Vehicle Exterior","https://images.bonanzastatic.com/afu/images/8144/f6a2/bbef_4472584945/08-07-11-Car2.jpg https://images.bonanzastatic.com/afu/images/507e/70c7/6adb_4472585211/08-07-18-carrrr.jpg https://images.bonanzastatic.com/afu/images/6d54/5335/f1fa_4472585666/08-07-23-carrrrrr.jpg https://images.bonanzastatic.com/afu/images/4f5c/381e/2e7c_4472586027/08-07-28-car_lashes_curves.jpg https://images.bonanzastatic.com/afu/images/7383/90c2/3fb7_4472586335/08-07-33-car5.jpg https://images.bonanzastatic.com/afu/images/e411/a72e/d577_4472586549/08-07-38-car6.jpg","     <div style=""color: rgb(64, 64, 64); font-family: Arial, Helvetica, FreeSans, sans-serif; font-size: 14px; box-sizing: content-box; margin: 0px; padding: 0px; border: 0px; font-variant-numeric: inherit; font-stretch: inherit; line-height: 16.9px; vertical-align: baseline; background-color: rgb(255, 255, 255);""> <div><span style='font-family: ""Trebuchet MS""; font-size: 12px;'><b><u>LIMITED TIME PROMOTION</u>!</b></span></div>  <div> </div> </div>  <div style=""color: rgb(64, 64, 64); font-family: Arial, Helvetica, FreeSans, sans-serif; font-size: 14px; box-sizing: content-box; margin: 0px; padding: 0px; border: 0px; font-variant-numeric: inherit; font-stretch: inherit; line-height: 16.9px; vertical-align: baseline; background-color: rgb(255, 255, 255);""> </div>  <div style=""color: rgb(64, 64, 64); font-family: Arial, Helvetica, FreeSans, sans-serif; font-size: 14px; box-sizing: content-box; margin: 0px; padding: 0px; border: 0px; font-variant-numeric: inherit; font-stretch: inherit; line-height: 16.9px; vertical-align: baseline; background-color: rgb(255, 255, 255);""><span style=""box-sizing: content-box; margin: 0px; padding: 0px; border: 0px; font-style: inherit; font-variant: inherit; font-weight: inherit; font-stretch: inherit; line-height: inherit; font-family: inherit; vertical-align: baseline;""><span style=""font-size: 25px;"">100% new never used ! Good quality!</span></span></div>  <div style=""color: rgb(64, 64, 64); font-family: Arial, Helvetica, FreeSans, sans-serif; font-size: 14px; box-sizing: content-box; margin: 0px; padding: 0px; border: 0px; font-variant-numeric: inherit; font-stretch: inherit; line-height: 16.9px; vertical-align: baseline; background-color: rgb(255, 255, 255);""> <div style=""box-sizing: content-box; margin: 0px; padding: 0px; border: 0px; font-style: inherit; font-variant: inherit; font-weight: inherit; font-stretch: inherit; line-height: inherit; font-family: inherit; vertical-align: baseline;""> <p style=""margin: 0px; box-sizing: content-box; padding: 0px; border: 0px; font-style: inherit; font-variant: inherit; font-weight: inherit; font-stretch: inherit; line-height: inherit; font-family: inherit; vertical-align: baseline;""><span style=""box-sizing: content-box; margin: 0px; padding: 0px; border: 0px; font-style: inherit; font-variant: inherit; font-weight: inherit; font-stretch: inherit; line-height: inherit; font-family: inherit; vertical-align: baseline;""><span style=""font-size: 25px;"">come with double sided tape that's durable yet doesn't hurt car paint.</span></span></p>  <p style=""margin: 0px; box-sizing: content-box; padding: 0px; border: 0px; font-style: inherit; font-variant: inherit; font-weight: inherit; font-stretch: inherit; line-height: inherit; font-family: inherit; vertical-align: baseline;""><br style=""box-sizing: content-box;""> <span style=""box-sizing: content-box; margin: 0px; padding: 0px; border: 0px; font-style: inherit; font-variant: inherit; font-weight: inherit; font-stretch: inherit; line-height: inherit; font-family: inherit; vertical-align: baseline;""><span style=""font-size: 25px;"">flexible and fit most Cars</span></span></p>  <p style=""margin: 0px; box-sizing: content-box; padding: 0px; border: 0px; font-style: inherit; font-variant: inherit; font-weight: inherit; font-stretch: inherit; line-height: inherit; font-family: inherit; vertical-align: baseline;""> </p>  <p style=""margin: 0px; box-sizing: content-box; padding: 0px; border: 0px; font-style: inherit; font-variant: inherit; font-weight: inherit; font-stretch: inherit; line-height: inherit; font-family: inherit; vertical-align: baseline;""><span style=""box-sizing: content-box; margin: 0px; padding: 0px; border: 0px; font-style: inherit; font-variant: inherit; font-weight: inherit; font-stretch: inherit; line-height: inherit; font-family: inherit; vertical-align: baseline;""><span style=""font-size: 25px;"">Made of durable plastic.</span></span></p>  <p style=""margin: 0px; box-sizing: content-box; padding: 0px; border: 0px; font-style: inherit; font-variant: inherit; font-weight: inherit; font-stretch: inherit; line-height: inherit; font-family: inherit; vertical-align: baseline;""> </p>  <p style=""margin: 0px; box-sizing: content-box; padding: 0px; border: 0px; font-style: inherit; font-variant: inherit; font-weight: inherit; font-stretch: inherit; line-height: inherit; font-family: inherit; vertical-align: baseline;""><span style=""box-sizing: content-box; margin: 0px; padding: 0px; border: 0px; font-style: inherit; font-variant: inherit; font-weight: inherit; font-stretch: inherit; line-height: inherit; font-family: inherit; vertical-align: baseline;""><span style=""box-sizing: content-box; margin: 0px; padding: 0px; border: 0px; font-style: inherit; font-variant: inherit; font-weight: inherit; font-stretch: inherit; line-height: 15.2px; font-family: inherit; vertical-align: baseline;""><span style=""font-size: x-large; line-height: 16.9px; font-family: inherit; font-style: inherit; font-variant-ligatures: inherit; font-variant-caps: inherit; font-weight: inherit;"">Package: </span><span style=""font-size: 25px;"">1 pair / each package.</span></span></span></p>  <p style=""margin: 0px; box-sizing: content-box; padding: 0px; border: 0px; font-style: inherit; font-variant: inherit; font-weight: inherit; font-stretch: inherit; line-height: inherit; font-family: inherit; vertical-align: baseline;""> </p> </div> </div>   ","[[Condition:New]] [[MPN:859198124376]] [[UPC:859198123002]] [[Brand:Lolashopfeb ]] ","4.9","flat","usps","International2to3weeks","normal","FALSE","TRUE"
"SKU1522083241","Star Ultimate Collector's Millennium Falcon Model Building Wars Kit 5265 Pieces  ","9","529.9","Arts & Entertainment >> Hobbies & Creative Arts >> Crafts & Hobbies >> Model Making >> Scale Model Kits","https://images.bonanzastatic.com/afu/images/9302/8048/4bb1_4808379205/-1004988056-1781537034.jpg https://images.bonanzastatic.com/afu/images/c73c/e19c/f3ab_4808379550/-6670291191607634339.jpg https://images.bonanzastatic.com/afu/images/7ed9/185e/6ab0_4808379610/2057545839-983597049.jpg https://images.bonanzastatic.com/afu/images/50df/c233/46da_4808379893/-747858568933114745.jpg https://images.bonanzastatic.com/afu/images/8de9/5bc1/5954_4808380123/-1026406325986713994.jpg https://images.bonanzastatic.com/afu/images/2553/0599/07d9_4808385659/1636804133402012209.jpg https://images.bonanzastatic.com/afu/images/7e3c/f439/83f7_4808385952/-106019557-1829858485.jpg https://images.bonanzastatic.com/afu/images/d5f3/9ff3/009e_4808386266/-391364507957585322.jpg","     Limited Time Discount!!!    ","[[Condition:New]] [[Brand:Lolashopfeb ]] ","4.9","flat","usps","International2to3weeks","normal","FALSE","TRUE"
"SKU1522083245","Princess Flower Girl Dress Summer 2017 Wedding Birthday Party Dresses For Girls ","676","39.9","Apparel & Accessories >> Clothing >> Dresses","https://images.bonanzastatic.com/afu/images/3c7d/5b19/ac75_4726553838/1527818822-1051151328.jpg https://images.bonanzastatic.com/afu/images/4596/1b3b/7e8b_4726574896/peach1.jpg","     <div><span style='font-family: ""Trebuchet MS""; font-size: 12px;'><b><u>LIMITED TIME PROMOTION</u>!</b></span></div>  <div><span style='font-family: ""Trebuchet MS"";'><b><span style=""font-size: 12px;"">YOU </span><span style=""font-size: 25px;"">BUY</span><span style=""font-size: 12px;""> </span><span style=""font-size: 30px;"">2</span><span style=""font-size: 12px;"">, I'LL </span><span style=""font-size: 25px;"">SHIP</span><span style=""font-size: 12px;""> </span><span style=""font-size: 30px;"">3</span></b></span></div>  <p><img alt=""c5 2-12"" src=""https://ae01.alicdn.com/kf/HTB1dGsHRpXXXXabXFXXq6xXFXXXN.jpg?size=127393&amp;height=451&amp;width=697&amp;hash=8a06eb2f99f03634d05e47baadc1977f""></p>  <p><span style=""box-sizing: content-box; margin: 0px; padding: 0px; border: 0px; font-variant-numeric: inherit; font-stretch: inherit; font-size: 20px; line-height: 24px; font-family: tahoma, arial; vertical-align: baseline; color: rgb(67, 67, 67); background-color: rgb(242, 242, 242);"">Tip:Because of different measuring methods, there may be 1-3 cm error, belongs to the normal</span><span style=""color: rgb(255, 0, 0); font-size: 20px; background-color: rgb(255, 255, 255);"">,please read size information before choose size,thanks.Unit:CM,1cm=0.3937inch</span></p>  <p> </p>  <p style='margin: 0px 0px 15px; box-sizing: border-box; color: rgb(88, 88, 88); font-family: HelveticaNeue, ""Helvetica Neue"", Helvetica, Arial, sans-serif; font-size: 15px; background-color: rgb(255, 255, 255);'><span style='box-sizing: border-box; color: rgb(0, 0, 0); font-family: ""Helvetica Neue"", Helvetica, Arial, sans-serif;'><strong style=""box-sizing: border-box;"">OUR 5 POINT CUSTOMER PROMISE</strong></span></p>  <p style='margin: 0px 0px 15px; box-sizing: border-box; color: rgb(88, 88, 88); font-family: HelveticaNeue, ""Helvetica Neue"", Helvetica, Arial, sans-serif; font-size: 15px; background-color: rgb(255, 255, 255);'><span style='box-sizing: border-box; color: rgb(0, 0, 0); font-family: ""Helvetica Neue"", Helvetica, Arial, sans-serif;'>1. 30 Day Money Back Guarantee<br style=""box-sizing: border-box;""> 2. Tracking number for every order<br style=""box-sizing: border-box;""> 3. Safe payments via Paypal®<br style=""box-sizing: border-box;""> 4. Real people on our help telephone and internet helpdesks<br style=""box-sizing: border-box;""> 5. Free shipping worldwide</span></p>   ","[[Condition:New with tags]] [[Brand:Lolashopfeb ]] [[Color:Beiges]] [[MPN:Girl Dress]] [[Size:2T][quantity:57][price:39.90]] [[Size:3T][quantity:48][price:39.90]] [[Size:4][quantity:47][price:39.90]] [[Size:5][quantity:88][price:39.90]] [[Size:6][quantity:54][price:39.90]] [[Size:7][quantity:58][price:39.90]] [[Size:8][quantity:56][price:39.90]] [[Size:9][quantity:53][price:39.90]] [[Size:10][quantity:51][price:39.90]] [[Size:11][quantity:53][price:39.90]] [[Size:12][quantity:59][price:39.90]] [[Size:13][quantity:52][price:39.90]] ","4.9","flat","usps","International2to3weeks","normal","FALSE","TRUE"
"SKU1522083249","Camp Chef Sushezi Roller Kit Sushi Mold Maker Bazooka Rolls Making Tool Rice ","16","8.9","Home & Garden >> Kitchen & Dining >> Tableware >> Dinnerware","https://images.bonanzastatic.com/afu/images/1991/3b80/a60c_4679678081/-2086302279-1417371773.jpg https://images.bonanzastatic.com/afu/images/d454/7c2c/d003_4679679601/-1363486809-1303327508.jpg https://images.bonanzastatic.com/afu/images/ecbf/7af5/7f81_4679680316/1842675938-808622007.jpg https://images.bonanzastatic.com/afu/images/8650/c04a/1faa_4679680739/-1071542012-340256572.jpg https://images.bonanzastatic.com/afu/images/5053/90da/1d00_4679681111/12582767761479259305.jpg","     Limited time discount!!!    ","[[Condition:New]] [[Secondary Color:Whites]] [[Style:Simple]] [[Design:Solid]] [[Material:Plastic]] [[Color:White]] [[MPN:Sushi]] [[Brand:Lolashopfeb ]] ","4.9","flat","usps","International2to3weeks","normal","FALSE","TRUE"
