"SKU","Title","Quantity","Price","Category","Images","Description","Traits","shipping_price","shipping_type","shipping_carrier","shipping_service","shipping_package","noindex","force_update"
"SKU1522083166","BITCOIN Physical Bitcoin in Proctective Acrylic Case Novelty Coin Free Shipping  ","56","10.99","Arts & Entertainment >> Hobbies & Creative Arts >> Collectibles >> Collectible Coins & Currency","https://images.bonanzastatic.com/afu/images/75a6/86a9/882c_5209109585/44274116834819240.jpg https://images.bonanzastatic.com/afu/images/ef44/0537/9f67_5209116637/813981123-1476508979.jpg https://images.bonanzastatic.com/afu/images/3875/542b/4e16_5209124617/449513190-310827736.jpg https://images.bonanzastatic.com/afu/images/461d/c5c2/6267_5209127177/1297841202870550642.jpg https://images.bonanzastatic.com/afu/images/7954/23c0/79c0_5209143040/630524319-308978421.jpg","     LIMITED TIME PROMOTION !!!     YOU BUY 2 I'LL SHIP 3   ","[[Condition:New]] [[MPN:BTC ]] ","4.9","flat","usps","International2to3weeks","normal","FALSE","TRUE"
"SKU1522083169","Insole Shoe Height Booster Men Heels Increase 3 Layer Aprox 2.5"" High Heels Men  ","12","39.9","Apparel & Accessories >> Clothing Accessories >> Earmuffs","https://images.bonanzastatic.com/afu/images/d0f9/f369/c3e5_5305734416/285586414-802768252.jpg https://images.bonanzastatic.com/afu/images/7695/ebb7/269e_5305735060/IMG_20180103_000329.jpg https://images.bonanzastatic.com/afu/images/6cdb/e1ac/21ee_5305735622/IMG_20180103_000357.jpg https://images.bonanzastatic.com/afu/images/b97c/6cc1/83a4_5305736116/IMG_20180103_000423.jpg https://images.bonanzastatic.com/afu/images/afb1/640c/212b_5305736644/IMG_20180103_000443.jpg https://images.bonanzastatic.com/afu/images/5312/d0b0/9667_5305737396/1909865541670767877.jpg https://images.bonanzastatic.com/afu/images/6f69/5548/193b_5305738052/1459207990-2106859608.jpg https://images.bonanzastatic.com/afu/images/4cae/2daa/84e1_5305738491/20371064301583340820.jpg","     Limited Time Discount!!!     You Buy 2, I'll ship 3   ","[[Condition:New with tags]] [[Brand:Lolashopfeb ]] [[Material:Urethane]] [[MPN:SY-31]] ","4.9","flat","usps","International2to3weeks","normal","FALSE","TRUE"
"SKU1522083173","Ariana Grande Hoodie Style S Arianator Everything Honeymoon Tour Woman Dangerous ","30","19.9","Apparel & Accessories >> Clothing >> Activewear","https://images.bonanzastatic.com/afu/images/6970/6cb1/fd5b_5319270779/2129631301-1725337535.jpg https://images.bonanzastatic.com/afu/images/6441/9a91/9bfb_5319272198/7102709502091124330.jpg https://images.bonanzastatic.com/afu/images/5ddd/8399/e063_5319282759/03-13-59-s-l1600.jpg","     Limited Time Discount!    ","[[Condition:New with tags]] [[Style:Casual]] [[Material:Polyester]] [[Country/Region of Manufacture:China]] [[UPC:643944492045]] [[Brand:Lolashopfeb ]] [[Size:L][quantity:5][price:19.90]] [[Size:M][quantity:5][price:19.90]] [[Size:S][quantity:5][price:19.90]] [[Size:XL][quantity:5][price:19.90]] [[Size:XS][quantity:5][price:19.90]] [[Size:XXL][quantity:5][price:19.90]] ","4.9","flat","usps","International2to3weeks","normal","FALSE","TRUE"
"SKU1522083177","Finger Monkey Cute Toy Baby Electronic Interactive Toy Robot Pet Kids Gift ","28","19.9","Toys & Games >> Toys >> Electronic Toys","https://images.bonanzastatic.com/afu/images/1f08/554d/ffd5_4951962589/-724308208-1729685777.jpg https://images.bonanzastatic.com/afu/images/20f2/265e/80f2_4951962891/-742015070-2001694624.jpg https://images.bonanzastatic.com/afu/images/ef95/25fc/59da_4951963264/-523838508-176619951.jpg https://images.bonanzastatic.com/afu/images/0e41/e538/1eab_4951963376/-1170166022-1290300802.jpg https://images.bonanzastatic.com/afu/images/731e/9cdb/51f4_4951966003/-7182506921769067518.jpg https://images.bonanzastatic.com/afu/images/1b04/27da/f0c4_4951966156/238436845-536983076.jpg https://images.bonanzastatic.com/afu/images/e96d/0f0e/f5e1_4951966397/-2092331358692897590.jpg https://images.bonanzastatic.com/afu/images/8a18/3b44/bf54_4951966548/-1541056851-1766399267.jpg https://images.bonanzastatic.com/afu/images/baf0/1a86/05b4_4951978219/16790378361033390202.jpg","     Limited Time Discount    ","[[Condition:New]] [[MPN:Finger Monkey ]] [[Recommended Age Range:>6 Years Old]] [[Brand:Lolashopfeb ]] ","4.9","flat","usps","International2to3weeks","normal","FALSE","TRUE"
"SKU1522083181","Black Car Lashes Headlight Eyelashes Accessories 3M Sticker - Universal ","49","6.99","Vehicles & Parts >> Vehicle Parts & Accessories >> Motor Vehicle Exterior","https://images.bonanzastatic.com/afu/images/b869/4abb/74d4_4306487346/Car2.jpg https://images.bonanzastatic.com/afu/images/0d4a/f22c/5f40_4243632475/carrrr.jpg https://images.bonanzastatic.com/afu/images/e947/c29c/fa5c_4243633075/carrrrrr.jpg https://images.bonanzastatic.com/afu/images/b9ff/43ac/f597_4243633527/car_lashes_curves.jpg https://images.bonanzastatic.com/afu/images/6117/0a26/64f1_4243635547/car5.jpg https://images.bonanzastatic.com/afu/images/21c6/4f5a/bd6d_4243636000/car6.jpg","     <div style=""box-sizing: content-box; margin: 0px; padding: 0px; border: 0px; font-variant-numeric: inherit; font-stretch: inherit; line-height: 16.9px; vertical-align: baseline; background-color: rgb(255, 255, 255);""> <div style=""background-color: rgb(255, 255, 255);""><span style=""font-family: Trebuchet MS;font-size: 12px;""><b><u>LIMITED TIME PROMOTION</u>! </b></span></div>  <div style=""background-color: rgb(255, 255, 255);""> </div> </div>  <div style=""box-sizing: content-box; margin: 0px; padding: 0px; border: 0px; font-variant-numeric: inherit; font-stretch: inherit; line-height: 16.9px; vertical-align: baseline; background-color: rgb(255, 255, 255);""> </div>  <div style=""box-sizing: content-box; margin: 0px; padding: 0px; border: 0px; font-variant-numeric: inherit; font-stretch: inherit; line-height: 16.9px; vertical-align: baseline; background-color: rgb(255, 255, 255);""><span style=""box-sizing: content-box; margin: 0px; padding: 0px; border: 0px; font-style: inherit; font-variant: inherit; font-weight: inherit; font-stretch: inherit; line-height: inherit; font-family: inherit; vertical-align: baseline;""><span style=""font-size: 25px;"">100% new never used ! Good quality!<span style=""box-sizing: content-box; margin: 0px; padding: 0px; border: 0px; font-style: inherit; font-variant: inherit; font-weight: inherit; font-stretch: inherit; line-height: 1.5; font-family: inherit; vertical-align: baseline;""> </span></span></span></div>  <div style=""box-sizing: content-box; margin: 0px; padding: 0px; border: 0px; font-variant-numeric: inherit; font-stretch: inherit; line-height: 16.9px; vertical-align: baseline; background-color: rgb(255, 255, 255);""> <div style=""box-sizing: content-box; margin: 0px; padding: 0px; border: 0px; font-style: inherit; font-variant: inherit; font-weight: inherit; font-stretch: inherit; line-height: inherit; font-family: inherit; vertical-align: baseline;""> <p style=""box-sizing: content-box; margin: 0px; padding: 0px; border: 0px; font-style: inherit; font-variant: inherit; font-weight: inherit; font-stretch: inherit; line-height: inherit; font-family: inherit; vertical-align: baseline;""><span style=""box-sizing: content-box; margin: 0px; padding: 0px; border: 0px; font-style: inherit; font-variant: inherit; font-weight: inherit; font-stretch: inherit; line-height: inherit; font-family: inherit; vertical-align: baseline;""><span style=""font-size: 25px;"">come with double sided tape that's durable yet doesn't hurt car paint.</span></span></p>  <p style=""box-sizing: content-box; margin: 0px; padding: 0px; border: 0px; font-style: inherit; font-variant: inherit; font-weight: inherit; font-stretch: inherit; line-height: inherit; font-family: inherit; vertical-align: baseline;""><br style=""box-sizing: content-box;""> <span style=""box-sizing: content-box; margin: 0px; padding: 0px; border: 0px; font-style: inherit; font-variant: inherit; font-weight: inherit; font-stretch: inherit; line-height: inherit; font-family: inherit; vertical-align: baseline;""><span style=""font-size: 25px;"">flexible and fit most Cars</span></span></p>  <p style=""box-sizing: content-box; margin: 0px; padding: 0px; border: 0px; font-style: inherit; font-variant: inherit; font-weight: inherit; font-stretch: inherit; line-height: inherit; font-family: inherit; vertical-align: baseline;""> </p>  <p style=""box-sizing: content-box; margin: 0px; padding: 0px; border: 0px; font-style: inherit; font-variant: inherit; font-weight: inherit; font-stretch: inherit; line-height: inherit; font-family: inherit; vertical-align: baseline;""><span style=""box-sizing: content-box; margin: 0px; padding: 0px; border: 0px; font-style: inherit; font-variant: inherit; font-weight: inherit; font-stretch: inherit; line-height: inherit; font-family: inherit; vertical-align: baseline;""><span style=""font-size: 25px;"">Made of durable plastic. </span></span></p>  <p style=""box-sizing: content-box; margin: 0px; padding: 0px; border: 0px; font-style: inherit; font-variant: inherit; font-weight: inherit; font-stretch: inherit; line-height: inherit; font-family: inherit; vertical-align: baseline;""> </p>  <p style=""box-sizing: content-box; margin: 0px; padding: 0px; border: 0px; font-style: inherit; font-variant: inherit; font-weight: inherit; font-stretch: inherit; line-height: inherit; font-family: inherit; vertical-align: baseline;""><span style=""box-sizing: content-box; margin: 0px; padding: 0px; border: 0px; font-style: inherit; font-variant: inherit; font-weight: inherit; font-stretch: inherit; line-height: inherit; font-family: inherit; vertical-align: baseline;""><span style=""box-sizing: content-box; margin: 0px; padding: 0px; border: 0px; font-style: inherit; font-variant: inherit; font-weight: inherit; font-stretch: inherit; line-height: 15.2px; font-family: inherit; vertical-align: baseline;""><span style=""font-size: x-large; line-height: 16.9px; font-family: inherit; font-style: inherit; font-variant-ligatures: inherit; font-variant-caps: inherit; font-weight: inherit;"">Package: </span><span style=""font-size: 25px;"">1 pair / each package.</span></span></span></p>  <p style=""box-sizing: content-box; margin: 0px; padding: 0px; border: 0px; font-style: inherit; font-variant: inherit; font-weight: inherit; font-stretch: inherit; line-height: inherit; font-family: inherit; vertical-align: baseline;""> </p>  <p style=""box-sizing: content-box; margin: 0px; padding: 0px; border: 0px; font-style: inherit; font-variant: inherit; font-weight: inherit; font-stretch: inherit; line-height: inherit; font-family: inherit; vertical-align: baseline;""> </p> </div> </div>   ","[[Condition:New]] [[MPN:859198124376]] [[UPC:859198123002]] [[Brand:Lolashopfeb ]] ","4.9","flat","usps","International2to3weeks","normal","FALSE","TRUE"
"SKU1522083185","2016 Chicago Cubs World Series Championship Ring Size 8-14 For RIZZO !! ","36","16.9","Arts & Entertainment >> Hobbies & Creative Arts >> Collectibles >> Sports Collectibles >> Sports Fan Accessories","https://images.bonanzastatic.com/afu/images/a114/422a/63b0_5319183797/-1419897552-1096458293.jpg https://images.bonanzastatic.com/afu/images/7427/c40e/97ec_5319184264/156583176-345360912.jpg https://images.bonanzastatic.com/afu/images/98a8/77e9/9358_5319184642/359762563-381749749.jpg https://images.bonanzastatic.com/afu/images/9317/263b/744e_5319189116/IMG_20180106_025449.jpg","     Limited Time Discount!    ","[[Condition:New]] [[Pre & Post Season:World Series]] [[Product:Ring]] [[Gender:Unisex Adult]] [[Team:Chicago Cubs]] [[Size:8][quantity:6][price:16.90]] [[Size:9][quantity:5][price:16.90]] [[Size:10][quantity:5][price:16.90]] [[Size:11][quantity:5][price:16.90]] [[Size:12][quantity:5][price:16.90]] [[Size:13][quantity:5][price:16.90]] [[Size:14][quantity:5][price:16.90]] ","4.9","flat","usps","International2to3weeks","normal","FALSE","TRUE"
"SKU1522083189","Black Car Lashes Headlight Eyelashes Accessories 3M Sticker - Universal ","125","6.99","Vehicles & Parts >> Vehicle Parts & Accessories >> Motor Vehicle Exterior","https://images.bonanzastatic.com/afu/images/9fe8/252a/c0d5_4472590483/08-07-11-Car2.jpg https://images.bonanzastatic.com/afu/images/55e4/fcf1/4af7_4472590619/08-07-18-carrrr.jpg https://images.bonanzastatic.com/afu/images/63c2/5f48/b378_4472590870/08-07-23-carrrrrr.jpg https://images.bonanzastatic.com/afu/images/2929/247f/7882_4472591100/08-07-28-car_lashes_curves.jpg https://images.bonanzastatic.com/afu/images/f259/97ad/8642_4472591410/08-07-33-car5.jpg https://images.bonanzastatic.com/afu/images/3c21/de80/a0a5_4472591621/08-07-38-car6.jpg","     <div style=""color: rgb(64, 64, 64); font-family: Arial, Helvetica, FreeSans, sans-serif; font-size: 14px; box-sizing: content-box; margin: 0px; padding: 0px; border: 0px; font-variant-numeric: inherit; font-stretch: inherit; line-height: 16.9px; vertical-align: baseline; background-color: rgb(255, 255, 255);""> <div><span style='font-family: ""Trebuchet MS""; font-size: 12px;'><b><u>LIMITED TIME PROMOTION</u>!</b></span></div>  <div> </div> </div>  <div style=""color: rgb(64, 64, 64); font-family: Arial, Helvetica, FreeSans, sans-serif; font-size: 14px; box-sizing: content-box; margin: 0px; padding: 0px; border: 0px; font-variant-numeric: inherit; font-stretch: inherit; line-height: 16.9px; vertical-align: baseline; background-color: rgb(255, 255, 255);""> </div>  <div style=""color: rgb(64, 64, 64); font-family: Arial, Helvetica, FreeSans, sans-serif; font-size: 14px; box-sizing: content-box; margin: 0px; padding: 0px; border: 0px; font-variant-numeric: inherit; font-stretch: inherit; line-height: 16.9px; vertical-align: baseline; background-color: rgb(255, 255, 255);""><span style=""box-sizing: content-box; margin: 0px; padding: 0px; border: 0px; font-style: inherit; font-variant: inherit; font-weight: inherit; font-stretch: inherit; line-height: inherit; font-family: inherit; vertical-align: baseline;""><span style=""font-size: 25px;"">100% new never used ! Good quality!</span></span></div>  <div style=""color: rgb(64, 64, 64); font-family: Arial, Helvetica, FreeSans, sans-serif; font-size: 14px; box-sizing: content-box; margin: 0px; padding: 0px; border: 0px; font-variant-numeric: inherit; font-stretch: inherit; line-height: 16.9px; vertical-align: baseline; background-color: rgb(255, 255, 255);""> <div style=""box-sizing: content-box; margin: 0px; padding: 0px; border: 0px; font-style: inherit; font-variant: inherit; font-weight: inherit; font-stretch: inherit; line-height: inherit; font-family: inherit; vertical-align: baseline;""> <p style=""margin: 0px; box-sizing: content-box; padding: 0px; border: 0px; font-style: inherit; font-variant: inherit; font-weight: inherit; font-stretch: inherit; line-height: inherit; font-family: inherit; vertical-align: baseline;""><span style=""box-sizing: content-box; margin: 0px; padding: 0px; border: 0px; font-style: inherit; font-variant: inherit; font-weight: inherit; font-stretch: inherit; line-height: inherit; font-family: inherit; vertical-align: baseline;""><span style=""font-size: 25px;"">come with double sided tape that's durable yet doesn't hurt car paint.</span></span></p>  <p style=""margin: 0px; box-sizing: content-box; padding: 0px; border: 0px; font-style: inherit; font-variant: inherit; font-weight: inherit; font-stretch: inherit; line-height: inherit; font-family: inherit; vertical-align: baseline;""><br style=""box-sizing: content-box;""> <span style=""box-sizing: content-box; margin: 0px; padding: 0px; border: 0px; font-style: inherit; font-variant: inherit; font-weight: inherit; font-stretch: inherit; line-height: inherit; font-family: inherit; vertical-align: baseline;""><span style=""font-size: 25px;"">flexible and fit most Cars</span></span></p>  <p style=""margin: 0px; box-sizing: content-box; padding: 0px; border: 0px; font-style: inherit; font-variant: inherit; font-weight: inherit; font-stretch: inherit; line-height: inherit; font-family: inherit; vertical-align: baseline;""> </p>  <p style=""margin: 0px; box-sizing: content-box; padding: 0px; border: 0px; font-style: inherit; font-variant: inherit; font-weight: inherit; font-stretch: inherit; line-height: inherit; font-family: inherit; vertical-align: baseline;""><span style=""box-sizing: content-box; margin: 0px; padding: 0px; border: 0px; font-style: inherit; font-variant: inherit; font-weight: inherit; font-stretch: inherit; line-height: inherit; font-family: inherit; vertical-align: baseline;""><span style=""font-size: 25px;"">Made of durable plastic.</span></span></p>  <p style=""margin: 0px; box-sizing: content-box; padding: 0px; border: 0px; font-style: inherit; font-variant: inherit; font-weight: inherit; font-stretch: inherit; line-height: inherit; font-family: inherit; vertical-align: baseline;""> </p>  <p style=""margin: 0px; box-sizing: content-box; padding: 0px; border: 0px; font-style: inherit; font-variant: inherit; font-weight: inherit; font-stretch: inherit; line-height: inherit; font-family: inherit; vertical-align: baseline;""><span style=""box-sizing: content-box; margin: 0px; padding: 0px; border: 0px; font-style: inherit; font-variant: inherit; font-weight: inherit; font-stretch: inherit; line-height: inherit; font-family: inherit; vertical-align: baseline;""><span style=""box-sizing: content-box; margin: 0px; padding: 0px; border: 0px; font-style: inherit; font-variant: inherit; font-weight: inherit; font-stretch: inherit; line-height: 15.2px; font-family: inherit; vertical-align: baseline;""><span style=""font-size: x-large; line-height: 16.9px; font-family: inherit; font-style: inherit; font-variant-ligatures: inherit; font-variant-caps: inherit; font-weight: inherit;"">Package: </span><span style=""font-size: 25px;"">1 pair / each package.</span></span></span></p>  <p style=""margin: 0px; box-sizing: content-box; padding: 0px; border: 0px; font-style: inherit; font-variant: inherit; font-weight: inherit; font-stretch: inherit; line-height: inherit; font-family: inherit; vertical-align: baseline;""> </p>  <p style=""margin: 0px; box-sizing: content-box; padding: 0px; border: 0px; font-style: inherit; font-variant: inherit; font-weight: inherit; font-stretch: inherit; line-height: inherit; font-family: inherit; vertical-align: baseline;""> </p>  <p style='margin: 0px 0px 15px; box-sizing: border-box; color: rgb(88, 88, 88); font-family: HelveticaNeue, ""Helvetica Neue"", Helvetica, Arial, sans-serif; font-size: 15px;'><span style='box-sizing: border-box; color: rgb(0, 0, 0); font-family: ""Helvetica Neue"", Helvetica, Arial, sans-serif;'><strong style=""box-sizing: border-box;"">OUR 5 POINT CUSTOMER PROMISE</strong></span></p>  <p style='margin: 0px 0px 15px; box-sizing: border-box; color: rgb(88, 88, 88); font-family: HelveticaNeue, ""Helvetica Neue"", Helvetica, Arial, sans-serif; font-size: 15px;'><span style='box-sizing: border-box; color: rgb(0, 0, 0); font-family: ""Helvetica Neue"", Helvetica, Arial, sans-serif;'>1. 30 Day Money Back Guarantee<br style=""box-sizing: border-box;""> 2. Tracking number for every order<br style=""box-sizing: border-box;""> 3. Safe payments via Paypal®<br style=""box-sizing: border-box;""> 4. Real people on our help telephone and internet helpdesks<br style=""box-sizing: border-box;""> 5. Free shipping worldwide</span></p> </div> </div>   ","[[Condition:New]] [[MPN:859198124376]] [[UPC:859198123002]] [[Brand:Lolashopfeb ]] ","4.9","flat","usps","International2to3weeks","normal","FALSE","TRUE"
