"SKU","Title","Quantity","Price","Category","Images","Description","Traits","shipping_price","shipping_type","shipping_carrier","shipping_service","shipping_package","noindex","force_update"
"SKU1522083208","Easy Gadget Kitchen Fruit Pineapple Corer Slicer Cutter Peeler Stainless Steel ","171","6.99","Home & Garden >> Kitchen & Dining >> Kitchen Tools & Utensils","https://images.bonanzastatic.com/afu/images/0401/8c96/6f59_4786983794/IMG_20170823_174049.jpg https://images.bonanzastatic.com/afu/images/97e7/00b0/531f_4786985417/IMG_20170823_174113.jpg https://images.bonanzastatic.com/afu/images/a82a/327a/77ce_4786986417/-8684341681562457103.jpg https://images.bonanzastatic.com/afu/images/383a/7099/0535_4786987854/-14072971431472751520.jpg https://images.bonanzastatic.com/afu/images/c381/4a78/a6d4_4786987685/-1554115272-253099573.jpg","     <p><strong>Limited Time Discount !!!</strong></p>  <p><strong>Description</strong></p>  <p><span style='font-family: ""Times New Roman"", Garamond, Goudy, serif; text-align: center;'>3 In 1 Pineapple Peeler, Corer &amp; Slicer</span><br style='font-family: ""Times New Roman"", Garamond, Goudy, serif; text-align: center;'> <span style='font-family: ""Times New Roman"", Garamond, Goudy, serif; text-align: center;'>Effortlessly Core &amp; Slice</span><br style='font-family: ""Times New Roman"", Garamond, Goudy, serif; text-align: center;'> <span style='font-family: ""Times New Roman"", Garamond, Goudy, serif; text-align: center;'>This New Product Does 3 Different Things At The Same Time.</span><br style='font-family: ""Times New Roman"", Garamond, Goudy, serif; text-align: center;'> <span style='font-family: ""Times New Roman"", Garamond, Goudy, serif; text-align: center;'>It Peels, Cores And Slices Fresh Pineapple With Ease.</span><br style='font-family: ""Times New Roman"", Garamond, Goudy, serif; text-align: center;'> <span style='font-family: ""Times New Roman"", Garamond, Goudy, serif; text-align: center;'>Simply Cut The Crown Off The Pineapple, Position The Cutting Disk On The Pineapple And Twist Whilst Pushing Down Slightly. </span><br style='font-family: ""Times New Roman"", Garamond, Goudy, serif; text-align: center;'> <span style='font-family: ""Times New Roman"", Garamond, Goudy, serif; text-align: center;'>Instantly You'll Have Perfect Pineapple Rings. </span><br style='font-family: ""Times New Roman"", Garamond, Goudy, serif; text-align: center;'> <span style='font-family: ""Times New Roman"", Garamond, Goudy, serif; text-align: center;'>All The Juice Is Retained During The Process</span></p>  <p> </p>  <p> </p>   ","[[Condition:New]] [[Brand:Lolashopfeb ]] ","4.9","flat","usps","International2to3weeks","normal","FALSE","TRUE"
"SKU1522083215","New England Patriots Super Bowl 2017 Tom Brady Championship Ring US size ","6","22","Arts & Entertainment >> Hobbies & Creative Arts >> Collectibles >> Sports Collectibles","https://images.bonanzastatic.com/afu/images/bab8/35e2/c561_4791860087/-1556623734-1409426308.jpg https://images.bonanzastatic.com/afu/images/ba16/39ec/ff96_4791860262/48744574749894248.jpg https://images.bonanzastatic.com/afu/images/ec2c/aa29/c08a_4791860392/442093061-1335516188.jpg https://images.bonanzastatic.com/afu/images/2b05/7c64/c860_4791860652/818377455490337979.jpg https://images.bonanzastatic.com/afu/images/fccb/ce1f/3bc1_4791860842/-519435534350061976.jpg","     Limited Time Discount!!!    ","[[Condition:New]] [[Product:Ring]] ","4.9","flat","usps","International2to3weeks","normal","FALSE","TRUE"
"SKU1522083220","Black Car Lashes Headlight Eyelashes Accessories 3M Sticker For all Jeep Cars ","141","10","Vehicles & Parts >> Vehicle Parts & Accessories >> Motor Vehicle Exterior","https://images.bonanzastatic.com/afu/images/1116/4f9a/4f98_4646241651/carrrr.jpg https://images.bonanzastatic.com/afu/images/2b97/4116/aa15_4646241754/car_lashes_curves.jpg https://images.bonanzastatic.com/afu/images/2457/f630/0150_4646241806/car5.jpg https://images.bonanzastatic.com/afu/images/fdaa/1319/7b4d_4646241902/car6.jpg","     <div style=""box-sizing: content-box; margin: 0px; padding: 0px; border: 0px; font-variant-numeric: inherit; font-stretch: inherit; line-height: 16.9px; vertical-align: baseline; background-color: rgb(255, 255, 255);""> <div><span style='font-family: ""Trebuchet MS""; font-size: 12px;'><b><u>LIMITED TIME PROMOTION</u>! </b></span></div>  <div><span style='font-family: ""Trebuchet MS"";'><b><span style=""font-size: 12px;"">YOU </span><span style=""font-size: 25px;"">BUY</span><span style=""font-size: 12px;""> </span><span style=""font-size: 30px;"">2</span><span style=""font-size: 12px;"">, I'LL </span><span style=""font-size: 25px;"">SHIP</span><span style=""font-size: 12px;""> </span><span style=""font-size: 30px;"">3</span></b></span></div> </div>  <div style=""box-sizing: content-box; margin: 0px; padding: 0px; border: 0px; font-variant-numeric: inherit; font-stretch: inherit; line-height: 16.9px; vertical-align: baseline; background-color: rgb(255, 255, 255);""> </div>  <div style=""box-sizing: content-box; margin: 0px; padding: 0px; border: 0px; font-variant-numeric: inherit; font-stretch: inherit; line-height: 16.9px; vertical-align: baseline; background-color: rgb(255, 255, 255);""><span style=""box-sizing: content-box; margin: 0px; padding: 0px; border: 0px; font-style: inherit; font-variant: inherit; font-weight: inherit; font-stretch: inherit; line-height: inherit; font-family: inherit; vertical-align: baseline;""><span style=""font-size: 25px;"">100% new never used ! Good quality!<span style=""box-sizing: content-box; margin: 0px; padding: 0px; border: 0px; font-style: inherit; font-variant: inherit; font-weight: inherit; font-stretch: inherit; line-height: 1.5; font-family: inherit; vertical-align: baseline;""> </span></span></span></div>  <div style=""box-sizing: content-box; margin: 0px; padding: 0px; border: 0px; font-variant-numeric: inherit; font-stretch: inherit; line-height: 16.9px; vertical-align: baseline; background-color: rgb(255, 255, 255);""> <div style=""box-sizing: content-box; margin: 0px; padding: 0px; border: 0px; font-style: inherit; font-variant: inherit; font-weight: inherit; font-stretch: inherit; line-height: inherit; font-family: inherit; vertical-align: baseline;""> <p style=""box-sizing: content-box; margin: 0px; padding: 0px; border: 0px; font-style: inherit; font-variant: inherit; font-weight: inherit; font-stretch: inherit; line-height: inherit; font-family: inherit; vertical-align: baseline;""><span style=""box-sizing: content-box; margin: 0px; padding: 0px; border: 0px; font-style: inherit; font-variant: inherit; font-weight: inherit; font-stretch: inherit; line-height: inherit; font-family: inherit; vertical-align: baseline;""><span style=""font-size: 25px;"">come with double sided tape that's durable yet doesn't hurt car paint.</span></span></p>  <p style=""box-sizing: content-box; margin: 0px; padding: 0px; border: 0px; font-style: inherit; font-variant: inherit; font-weight: inherit; font-stretch: inherit; line-height: inherit; font-family: inherit; vertical-align: baseline;""><br style=""box-sizing: content-box;""> <span style=""box-sizing: content-box; margin: 0px; padding: 0px; border: 0px; font-style: inherit; font-variant: inherit; font-weight: inherit; font-stretch: inherit; line-height: inherit; font-family: inherit; vertical-align: baseline;""><span style=""font-size: 25px;"">flexible and fit most Cars</span></span></p>  <p style=""box-sizing: content-box; margin: 0px; padding: 0px; border: 0px; font-style: inherit; font-variant: inherit; font-weight: inherit; font-stretch: inherit; line-height: inherit; font-family: inherit; vertical-align: baseline;""> </p>  <p style=""box-sizing: content-box; margin: 0px; padding: 0px; border: 0px; font-style: inherit; font-variant: inherit; font-weight: inherit; font-stretch: inherit; line-height: inherit; font-family: inherit; vertical-align: baseline;""><span style=""box-sizing: content-box; margin: 0px; padding: 0px; border: 0px; font-style: inherit; font-variant: inherit; font-weight: inherit; font-stretch: inherit; line-height: inherit; font-family: inherit; vertical-align: baseline;""><span style=""font-size: 25px;"">Made of durable plastic. </span></span></p>  <p style=""box-sizing: content-box; margin: 0px; padding: 0px; border: 0px; font-style: inherit; font-variant: inherit; font-weight: inherit; font-stretch: inherit; line-height: inherit; font-family: inherit; vertical-align: baseline;""> </p>  <p style=""box-sizing: content-box; margin: 0px; padding: 0px; border: 0px; font-style: inherit; font-variant: inherit; font-weight: inherit; font-stretch: inherit; line-height: inherit; font-family: inherit; vertical-align: baseline;""><span style=""box-sizing: content-box; margin: 0px; padding: 0px; border: 0px; font-style: inherit; font-variant: inherit; font-weight: inherit; font-stretch: inherit; line-height: inherit; font-family: inherit; vertical-align: baseline;""><span style=""box-sizing: content-box; margin: 0px; padding: 0px; border: 0px; font-style: inherit; font-variant: inherit; font-weight: inherit; font-stretch: inherit; line-height: 15.2px; font-family: inherit; vertical-align: baseline;""><span style=""font-size: x-large; line-height: 16.9px; font-family: inherit; font-style: inherit; font-variant-ligatures: inherit; font-variant-caps: inherit; font-weight: inherit;"">Package: </span><span style=""font-size: 25px;"">1 pair / each package.</span></span></span></p>  <p style=""box-sizing: content-box; margin: 0px; padding: 0px; border: 0px; font-style: inherit; font-variant: inherit; font-weight: inherit; font-stretch: inherit; line-height: inherit; font-family: inherit; vertical-align: baseline;""> </p>  <p style=""box-sizing: content-box; margin: 0px; padding: 0px; border: 0px; font-style: inherit; font-variant: inherit; font-weight: inherit; font-stretch: inherit; line-height: inherit; font-family: inherit; vertical-align: baseline;""> </p>  <p style=""box-sizing: content-box; margin: 0px; padding: 0px; border: 0px; font-style: inherit; font-variant: inherit; font-weight: inherit; font-stretch: inherit; line-height: inherit; font-family: inherit; vertical-align: baseline;""> </p></div></div>   ","[[Condition:New]] [[Brand:Lolashopfeb ]] ","4.9","flat","usps","International2to3weeks","normal","FALSE","TRUE"
"SKU1522083224","DIY Windshield Glass Repair Kit Stone Damage Chip Model ","98","7.69","Vehicles & Parts >> Vehicle Parts & Accessories","https://images.bonanzastatic.com/afu/images/01b9/037e/3483_4830824673/-1966543662-83501488.jpg https://images.bonanzastatic.com/afu/images/ad93/1eb6/8f25_4838560510/1504900002814798710.jpg https://images.bonanzastatic.com/afu/images/8bc7/c7e2/604f_4838561343/756935464-881625420.jpg https://images.bonanzastatic.com/afu/images/83f7/aa5e/e1d7_4838561939/-1920262101-829433297.jpg https://images.bonanzastatic.com/afu/images/dd71/9a7e/0a29_4838562465/1734980597-161510017.jpg","     <p style='box-sizing: content-box; margin: 0px; padding: 0px; border: 0px; font-variant-numeric: inherit; font-stretch: inherit; font-size: 13px; line-height: inherit; font-family: ""Open Sans"", Arial, Helvetica, sans-serif, SimSun, ??; vertical-align: baseline; background-color: rgb(255, 255, 255);'><b style='font-family: ""Trebuchet MS""; font-size: 12px; background-color: rgb(255, 255, 255);'><u>LIMITED TIME PROMOTION</u>!</b></p>  <p style='box-sizing: content-box; margin: 0px; padding: 0px; border: 0px; font-variant-numeric: inherit; font-stretch: inherit; font-size: 13px; line-height: inherit; font-family: ""Open Sans"", Arial, Helvetica, sans-serif, SimSun, ??; vertical-align: baseline; background-color: rgb(255, 255, 255);'><span style=""box-sizing: content-box; margin: 0px; padding: 0px; border: 0px; font-style: inherit; font-variant: inherit; font-weight: inherit; font-stretch: inherit; font-size: inherit; line-height: inherit; font-family: inherit; vertical-align: baseline;""><span style=""box-sizing: content-box; margin: 0px; padding: 0px; border: 0px; font-style: inherit; font-variant: inherit; font-weight: inherit; font-stretch: inherit; font-size: 14px; line-height: inherit; font-family: inherit; vertical-align: baseline;""><span style=""box-sizing: content-box; margin: 0px; padding: 0px; border: 0px; font-style: inherit; font-variant: inherit; font-weight: inherit; font-stretch: inherit; font-size: inherit; line-height: inherit; font-family: arial, helvetica, sans-serif; vertical-align: baseline;""><span style=""box-sizing: content-box; font-weight: 700;""> </span></span></span></span></p>  <p style='box-sizing: content-box; margin: 0px; padding: 0px; border: 0px; font-variant-numeric: inherit; font-stretch: inherit; font-size: 13px; line-height: inherit; font-family: ""Open Sans"", Arial, Helvetica, sans-serif, SimSun, ??; vertical-align: baseline; background-color: rgb(255, 255, 255);'><span style=""box-sizing: content-box; margin: 0px; padding: 0px; border: 0px; font-style: inherit; font-variant: inherit; font-weight: inherit; font-stretch: inherit; font-size: inherit; line-height: inherit; font-family: inherit; vertical-align: baseline;""><span style=""box-sizing: content-box; margin: 0px; padding: 0px; border: 0px; font-style: inherit; font-variant: inherit; font-weight: inherit; font-stretch: inherit; font-size: 14px; line-height: inherit; font-family: inherit; vertical-align: baseline;""><span style=""box-sizing: content-box; margin: 0px; padding: 0px; border: 0px; font-style: inherit; font-variant: inherit; font-weight: inherit; font-stretch: inherit; font-size: inherit; line-height: inherit; font-family: arial, helvetica, sans-serif; vertical-align: baseline;""><span style=""box-sizing: content-box; font-weight: 700;""> Features:</span></span></span></span></p>  <p style='box-sizing: content-box; margin: 0px; padding: 0px; border: 0px; font-variant-numeric: inherit; font-stretch: inherit; font-size: 13px; line-height: inherit; font-family: ""Open Sans"", Arial, Helvetica, sans-serif, SimSun, ??; vertical-align: baseline; background-color: rgb(255, 255, 255);'><span style=""box-sizing: content-box; margin: 0px; padding: 0px; border: 0px; font-style: inherit; font-variant: inherit; font-weight: inherit; font-stretch: inherit; font-size: inherit; line-height: inherit; font-family: inherit; vertical-align: baseline;""><span style=""box-sizing: content-box; margin: 0px; padding: 0px; border: 0px; font-style: inherit; font-variant: inherit; font-weight: inherit; font-stretch: inherit; font-size: 14px; line-height: inherit; font-family: inherit; vertical-align: baseline;""><span style=""box-sizing: content-box; margin: 0px; padding: 0px; border: 0px; font-style: inherit; font-variant: inherit; font-weight: inherit; font-stretch: inherit; font-size: inherit; line-height: inherit; font-family: arial, helvetica, sans-serif; vertical-align: baseline;"">Allows anyone to fix a damaged windshield or window.<br style=""box-sizing: content-box;""> Single ingredient - eliminates mixing.<br style=""box-sizing: content-box;""> Creates an invisible, undetectable repair in damaged automobile windshields or other laminated glass for windows.(Icludes instructions.)<br style=""box-sizing: content-box;""> DIY windshield repair kit is designed to fill the air cavity with a strong penetrating adhesive that will bond the loose glass and restore the visibility.<br style=""box-sizing: content-box;""> The patented design evacuates the air to fill the cavities with specially formulated liquid glass,that distortion and bonds the loose glass preventing the damage  from spreading.<br style=""box-sizing: content-box;""> Size: 10.3cm(Length) ,5cm( Diameter )<br style=""box-sizing: content-box;""> Weight: 28g<br style=""box-sizing: content-box;""> Material :Plastic &amp; Rubber<br style=""box-sizing: content-box;""> <br style=""box-sizing: content-box;""> <span style=""box-sizing: content-box; font-weight: 700;"">Note:</span><br style=""box-sizing: content-box;""> Avoid using in direct sunlight-work in shaded area.<br style=""box-sizing: content-box;""> Do not work on a hot windshield, park vehicle in shaded area and open for windows to cool glass surface.<br style=""box-sizing: content-box;""> A safety razor is required to remove components and finsh repair.<br style=""box-sizing: content-box;""> Do not let resin come in contact with painted surfaces.<br style=""box-sizing: content-box;""> <br style=""box-sizing: content-box;""> <span style=""box-sizing: content-box; font-weight: 700;"">Package contents:</span></span></span></span></p>  <p style='box-sizing: content-box; margin: 0px; padding: 0px; border: 0px; font-variant-numeric: inherit; font-stretch: inherit; font-size: 13px; line-height: inherit; font-family: ""Open Sans"", Arial, Helvetica, sans-serif, SimSun, ??; vertical-align: baseline; background-color: rgb(255, 255, 255);'><span style=""box-sizing: content-box; margin: 0px; padding: 0px; border: 0px; font-style: inherit; font-variant: inherit; font-weight: inherit; font-stretch: inherit; font-size: inherit; line-height: inherit; font-family: inherit; vertical-align: baseline;""><span style=""box-sizing: content-box; margin: 0px; padding: 0px; border: 0px; font-style: inherit; font-variant: inherit; font-weight: inherit; font-stretch: inherit; font-size: 14px; line-height: inherit; font-family: inherit; vertical-align: baseline;""><span style=""box-sizing: content-box; margin: 0px; padding: 0px; border: 0px; font-style: inherit; font-variant: inherit; font-weight: inherit; font-stretch: inherit; font-size: inherit; line-height: inherit; font-family: arial, helvetica, sans-serif; vertical-align: baseline;"">1 x Windshield Repair Injector<br style=""box-sizing: content-box;""> 1 x repair resin<br style=""box-sizing: content-box;""> 1 x Adhesive Seal<br style=""box-sizing: content-box;""> 1 x Pedestal<br style=""box-sizing: content-box;""> 5 x repair Film<br style=""box-sizing: content-box;""> 1 x Razor Blade<br style=""box-sizing: content-box;""> 1 x Instruction Manual</span></span></span></p>  <p style='box-sizing: content-box; margin: 0px; padding: 0px; border: 0px; font-variant-numeric: inherit; font-stretch: inherit; font-size: 13px; line-height: inherit; font-family: ""Open Sans"", Arial, Helvetica, sans-serif, SimSun, ??; vertical-align: baseline; background-color: rgb(255, 255, 255);'><span style=""box-sizing: content-box; margin: 0px; padding: 0px; border: 0px; font-style: inherit; font-variant: inherit; font-weight: inherit; font-stretch: inherit; font-size: inherit; line-height: inherit; font-family: inherit; vertical-align: baseline;""><span style=""box-sizing: content-box; margin: 0px; padding: 0px; border: 0px; font-style: inherit; font-variant: inherit; font-weight: inherit; font-stretch: inherit; font-size: 14px; line-height: inherit; font-family: inherit; vertical-align: baseline;""><span style=""box-sizing: content-box; margin: 0px; padding: 0px; border: 0px; font-style: inherit; font-variant: inherit; font-weight: inherit; font-stretch: inherit; font-size: inherit; line-height: inherit; font-family: arial, helvetica, sans-serif; vertical-align: baseline;""> </span></span></span></p>  <p style='box-sizing: content-box; margin: 0px; padding: 0px; border: 0px; font-variant-numeric: inherit; font-stretch: inherit; font-size: 13px; line-height: inherit; font-family: ""Open Sans"", Arial, Helvetica, sans-serif, SimSun, ??; vertical-align: baseline; background-color: rgb(255, 255, 255);'> </p>  <p style='box-sizing: content-box; margin: 0px; padding: 0px; border: 0px; font-variant-numeric: inherit; font-stretch: inherit; font-size: 13px; line-height: inherit; font-family: ""Open Sans"", Arial, Helvetica, sans-serif, SimSun, ??; vertical-align: baseline; background-color: rgb(255, 255, 255);'><span style=""box-sizing: content-box; margin: 0px; padding: 0px; border: 0px; font-style: inherit; font-variant: inherit; font-weight: inherit; font-stretch: inherit; font-size: inherit; line-height: inherit; font-family: inherit; vertical-align: baseline;""><span style=""box-sizing: content-box; margin: 0px; padding: 0px; border: 0px; font-style: inherit; font-variant: inherit; font-weight: inherit; font-stretch: inherit; font-size: 14px; line-height: inherit; font-family: inherit; vertical-align: baseline;""><span style=""box-sizing: content-box; margin: 0px; padding: 0px; border: 0px; font-style: inherit; font-variant: inherit; font-weight: inherit; font-stretch: inherit; font-size: inherit; line-height: inherit; font-family: arial, helvetica, sans-serif; vertical-align: baseline;""><img alt=""aeProduct.getSubject()"" src=""https://ae01.alicdn.com/kf/HTB1oMCPNVXXXXbKaXXXq6xXFXXXU/227320048/HTB1oMCPNVXXXXbKaXXXq6xXFXXXU.jpg"" style=""box-sizing: content-box; margin: 0px; padding: 0px; border: 0px; font-style: inherit; font-variant: inherit; font-weight: inherit; font-stretch: inherit; font-size: 0px; line-height: inherit; font-family: inherit; vertical-align: middle; color: transparent; max-width: 100%;""><img alt=""aeProduct.getSubject()"" src=""https://ae01.alicdn.com/kf/HTB1peqDNVXXXXcDapXXq6xXFXXXH/227320048/HTB1peqDNVXXXXcDapXXq6xXFXXXH.jpg"" style=""box-sizing: content-box; margin: 0px; padding: 0px; border: 0px; font-style: inherit; font-variant: inherit; font-weight: inherit; font-stretch: inherit; font-size: 0px; line-height: inherit; font-family: inherit; vertical-align: middle; color: transparent; max-width: 100%;""><img alt=""aeProduct.getSubject()"" src=""https://ae01.alicdn.com/kf/HTB1U8CHNVXXXXaMapXXq6xXFXXXX/227320048/HTB1U8CHNVXXXXaMapXXq6xXFXXXX.jpg"" style=""box-sizing: content-box; margin: 0px; padding: 0px; border: 0px; font-style: inherit; font-variant: inherit; font-weight: inherit; font-stretch: inherit; font-size: 0px; line-height: inherit; font-family: inherit; vertical-align: middle; color: transparent; max-width: 100%;""><img alt=""aeProduct.getSubject()"" src=""https://ae01.alicdn.com/kf/HTB1DJu4NVXXXXaTXFXXq6xXFXXXc/227320048/HTB1DJu4NVXXXXaTXFXXq6xXFXXXc.jpg"" style=""box-sizing: content-box; margin: 0px; padding: 0px; border: 0px; font-style: inherit; font-variant: inherit; font-weight: inherit; font-stretch: inherit; font-size: 0px; line-height: inherit; font-family: inherit; vertical-align: middle; color: transparent; max-width: 100%;""><img alt=""aeProduct.getSubject()"" src=""https://ae01.alicdn.com/kf/HTB1T8m8NVXXXXcxXpXXq6xXFXXXA/227320048/HTB1T8m8NVXXXXcxXpXXq6xXFXXXA.jpg"" style=""box-sizing: content-box; margin: 0px; padding: 0px; border: 0px; font-style: inherit; font-variant: inherit; font-weight: inherit; font-stretch: inherit; font-size: 0px; line-height: inherit; font-family: inherit; vertical-align: middle; color: transparent; max-width: 100%;""><img alt=""aeProduct.getSubject()"" src=""https://ae01.alicdn.com/kf/HTB1wKG4NVXXXXbLXFXXq6xXFXXXb/227320048/HTB1wKG4NVXXXXbLXFXXq6xXFXXXb.jpg"" style=""box-sizing: content-box; margin: 0px; padding: 0px; border: 0px; font-style: inherit; font-variant: inherit; font-weight: inherit; font-stretch: inherit; font-size: 0px; line-height: inherit; font-family: inherit; vertical-align: middle; color: transparent; max-width: 100%;""><img alt=""aeProduct.getSubject()"" src=""https://ae01.alicdn.com/kf/HTB1xUy_NVXXXXXvXFXXq6xXFXXXz/227320048/HTB1xUy_NVXXXXXvXFXXq6xXFXXXz.jpg"" style=""box-sizing: content-box; margin: 0px; padding: 0px; border: 0px; font-style: inherit; font-variant: inherit; font-weight: inherit; font-stretch: inherit; font-size: 0px; line-height: inherit; font-family: inherit; vertical-align: middle; color: transparent; max-width: 100%;""></span></span></span></p>   ","[[Condition:New]] [[Brand:Lolashopfeb  ]] ","4.9","flat","usps","International2to3weeks","normal","FALSE","TRUE"
